{
  "schema_version": 1,
  "projection_id": "agent-host-runtime-approval-v6",
  "contracts_version": "0.7.0",
  "status": "source_first_not_implemented",
  "runtime": {
    "repository": "https://github.com/36Dge/yijie-codex.git",
    "repository_commit": "b2b20e2fc4a0c94834f34d8cc459e488a1b56277",
    "upstream_tag": "rust-v0.144.6",
    "upstream_commit": "5d1fbf26c43abc65a203928b2e31561cb039e06d",
    "version": "0.144.6",
    "transport": "stdio",
    "experimental_api": false,
    "schema_file_count": 267,
    "schema_tree_sha256": "82ee9de771cf1d41bac16d87380f1121e7794107aa3aa526ad702d5d1bf7afe1",
    "schema_artifacts": {
      "ServerRequest.json": "58dde2ece68714cf5349428fcef0d413ecac58dc6dda8d47ef2d7d6aa9884337",
      "CommandExecutionRequestApprovalParams.json": "9a4a32a860c0b40b2e77b116677d9188510e67a5d437d802f01cad2ad8c9678e",
      "CommandExecutionRequestApprovalResponse.json": "db8384b633b9cee62f152328c5053ebaaa90299e0e686451c13de75fc01bafbd",
      "ServerNotification.json": "cf64e0f4a26e0e6c34f242d6c96f9151eb90484fc37d0bf206cd4b0bff1f3d58"
    }
  },
  "activation": {
    "exposure": "local",
    "profile": "demo_fast",
    "feature_gate": "FEAT-137",
    "approval_policy": "on-request",
    "fallback_approval_policy": "never",
    "sandbox": "read-only",
    "experimental_api": false
  },
  "reverse_request": {
    "method": "item/commandExecution/requestApproval",
    "jsonrpc_version_member": "absent",
    "outer_request_id": {
      "wire_types": {
        "runtime_generated": "integer",
        "schema_alternate": "string"
      },
      "runtime_generator": "integer_monotonic_from_zero_per_runtime_process",
      "scope": "runtime_process_generation",
      "exposed_to_yijie_surfaces": false
    },
    "stable_required_params": {
      "item_id": "itemId",
      "started_at_ms": "startedAtMs",
      "thread_id": "threadId",
      "turn_id": "turnId"
    },
    "wire_shape": {
      "outer_required_fields": {
        "request_id": "id",
        "method": "method",
        "params": "params"
      },
      "outer_additional_properties": "forbidden",
      "params_required_fields": {
        "thread_id": "threadId",
        "turn_id": "turnId",
        "item_id": "itemId",
        "started_at_ms": "startedAtMs",
        "command": "command",
        "command_actions": "commandActions",
        "cwd": "cwd"
      },
      "params_optional_fields": {
        "approval_id": "approvalId",
        "environment_id": "environmentId",
        "available_decisions": "availableDecisions"
      },
      "params_additional_properties": "forbidden"
    },
    "identity_binding": {
      "thread_id": "equals_host_session_runtime_thread_id",
      "turn_id": "equals_host_active_turn_id",
      "item_id": "equals_host_expected_command_item_id",
      "validation_order": "before_pending_projection_and_replay_fingerprint",
      "mismatch_behavior": "cancel_once_without_desktop_projection"
    },
    "correlation": {
      "replay_key_fields": {
        "runtime_generation": "runtime_generation",
        "request_id": "request_id"
      },
      "replay_key_extraction_order": "after_exact_outer_shape_before_params_eligibility",
      "same_key_replay": "reuse_approval_request_id_revision_requested_at_and_expires_at",
      "same_key_payload_conflict": "cancel_original_once_resolve_existing_pending_elsewhere_without_new_requested_projection",
      "replay_payload_equivalence": {
        "version": 1,
        "canonical_fields": {
          "thread_id": "exact_host_bound_runtime_thread_identity",
          "turn_id": "exact_host_active_turn_identity",
          "item_id": "exact_host_expected_command_item_identity",
          "command": "exact_command_string",
          "command_actions": "exact_single_unknown_command_action",
          "cwd": "canonical_host_workspace_identity",
          "environment_id": "normalize_absent_null_or_exact_host_local_to_host_local_identity",
          "approval_id": "normalize_absent_or_null_to_none",
          "started_at_ms": "exact_integer_value"
        },
        "ignored_fields": {
          "available_decisions": "availableDecisions"
        },
        "comparison": "exact_canonical_object",
        "equivalent_same_key": "reuse_pending_authority_without_ttl_reset",
        "different_same_key": "cancel_original_once_resolve_existing_pending_elsewhere_without_new_requested_projection"
      },
      "request_id_reuse_across_runtime_generations": "distinct_request",
      "runtime_identity_storage": "host_pending_memory_only"
    },
    "eligibility": {
      "command": "git rev-parse --is-inside-work-tree",
      "command_actions": {
        "exact_count": 1,
        "type": "unknown",
        "command": "git rev-parse --is-inside-work-tree",
        "additional_properties": "forbidden"
      },
      "approval_id": "absent_or_null",
      "cwd": "canonical_equal_to_host_known_workspace_root",
      "environment_id": "absent_null_or_exact_host_known_local_environment",
      "must_be_absent": {
        "reason": "reason",
        "network_approval_context": "networkApprovalContext",
        "additional_permissions": "additionalPermissions",
        "proposed_execpolicy_amendment": "proposedExecpolicyAmendment",
        "proposed_network_policy_amendments": "proposedNetworkPolicyAmendments"
      },
      "ignored_if_present": {
        "available_decisions": "availableDecisions"
      },
      "started_at_ms": "required_integer_non_authoritative_for_ttl",
      "ineligible_request": "cancel_once_without_desktop_projection"
    }
  },
  "runtime_response": {
    "accept_once": {
      "decision": "accept"
    },
    "cancel_current_turn": {
      "decision": "cancel"
    },
    "ttl_expired": {
      "decision": "cancel"
    },
    "forbidden_runtime_decisions": {
      "accept_for_session": "acceptForSession",
      "accept_with_execpolicy_amendment": "acceptWithExecpolicyAmendment",
      "apply_network_policy_amendment": "applyNetworkPolicyAmendment",
      "decline": "decline"
    },
    "malformed_response_fallback": "forbidden",
    "max_responses_per_request": 1
  },
  "lifecycle": {
    "ttl_seconds": 120,
    "ttl_clock": "host_monotonic_receive_time",
    "runtime_started_at_ms_is_ttl_authority": false,
    "race_policy": "first_writer_wins",
    "race_participants": {
      "user_decision": "user_decision",
      "ttl": "ttl",
      "server_request_resolved": "server_request_resolved",
      "item_terminal": "item_terminal",
      "turn_terminal": "turn_terminal"
    },
    "ttl_winner": "send_cancel_once_then_resolve_expired",
    "authority_cleanup_winner": "resolve_elsewhere_without_runtime_response",
    "decision_ack_authority": "serverRequest/resolved",
    "resolution_acknowledgement": {
      "method": "serverRequest/resolved",
      "required_params": {
        "request_id": "requestId",
        "thread_id": "threadId"
      },
      "correlation": {
        "runtime_generation": "same_runtime_process_generation",
        "request_id": "exact_json_type_and_value",
        "thread_id": "exact_runtime_thread_id"
      },
      "matching_notification": "permit_one_decision_http_200_transition",
      "mismatch_behavior": "does_not_acknowledge_or_emit_http_200",
      "duplicate_behavior": "idempotent_no_second_transition",
      "timeout_behavior": "approval_unavailable_without_http_200_then_snapshot_reconcile"
    },
    "terminal_authority": "runtime_item_and_turn_terminal",
    "max_pending_per_session": 1,
    "pending_overflow": "cancel_new_request_once_without_desktop_projection",
    "automatic_decision_retry": false
  }
}
